title,content,description,publishedAt,source,url,Sentiment
How we work: Oliver Haslam's MacBook Pro-powered setup,"While Oliver works from his home office most days, having the setup powered by a 16-inch MacBook Pro means he can work from just about anywhere.
I've been a full-time writer of words for coming up t… [+6046 chars]","While Oliver works from his home office most days, having the setup powered by a 16-inch MacBook Pro means he can work from just about anywhere.This is where I get most of my work done, but the MacBook Pro means I can write anywhere.I've been a full-time writ…",2025-01-01T20:24:07Z,AppleInsider,https://appleinsider.com/articles/25/01/01/how-we-work-oliver-haslams-macbook-pro-powered-setup,Positive
"Nvidia is giving away classic GPUs, framed and signed by the CEO","Skip to contentType your search and hit enter
When you purchase through links in our articles, we may earn a small commission. This doesn't affect our editorial independence
.
It might be cringewo… [+1877 chars]","It might be cringeworthy to be an unpaid cheerleader for an electronics company, but as a PC nerd, even I can’t deny the appeal of classic electronics framed and presented like pieces of art. Throw in a bit of autographed scarcity and it becomes irresistible.…",2025-01-02T16:02:58Z,PCWorld,https://www.pcworld.com/article/2566970/nvidia-is-giving-away-framed-classic-gpus-signed-by-the-ceo.html,Neutral
The 2024 M4 iMac 256GB is $105 Off,"Apple’s latest all-in-one desktop computer is discounted at an attractive rate. Today, the M4 iMac with 16GB Unified Memory and 256GB SSD storage is down to just $1,194 from its original price of $1,… [+688 chars]","Apple’s latest all-in-one desktop computer is discounted at an attractive rate. Today, the M4 iMac with 16GB Unified Memory and 256GB SSD storage is down to just $1,194 from its original price of $1,300 on Amazon. The M4 iMac gives you a 24-inch display with …",2025-01-06T09:57:36Z,iLounge,https://www.ilounge.com/news/the-2024-m4-imac-256gb-is-105-off,Positive
AMD Dazzles CES Crowd With 9950X3D Desktop CPU and Ryzen AI Max Mobile Processors,"At CES 2025, AMD is launching many new CPUs, and the most interesting ones are the high-end AMD Ryzen 9 9950X3D desktop CPU, and the AMD Ryzen AI MAX and MAX Pro for laptops.
The 16-core 9950X3D wit… [+2123 chars]","At CES 2025, AMD is launching many new CPUs, and the most interesting ones are the high-end AMD Ryzen 9 9950X3D desktop CPU, and the AMD Ryzen AI MAX and MAX Pro for laptops.The 16-core 9950X3D with 144MB of cache (!!) is a nice addition to the 7950X3D deskto…",2025-01-06T22:40:50Z,Ubergizmo,https://www.ubergizmo.com/2025/01/amd-dazzles-ces-crowd-with-9950x3d-desktop-cpu-and-ryzen-ai-max-mobile-processors/,Positive
Xiaomi intensifies LLM investment with GPU cluster,"Save my User ID and Password
Some subscribers prefer to save their log-in information so they do not have to enter their User ID and Password each time they visit the site. To activate this function… [+307 chars]","Xiaomi is reportedly in the process of constructing a massive GPU cluster to significantly invest in artificial intelligence (AI) large language models (LLMs). According to a source cited by Jiemian News, Xiaomi's LLM team had already established 6,500 GPU re…",2025-01-02T08:38:59Z,Digitimes,https://www.digitimes.com/news/a20241230PD214/xiaomi-llm-gpu-investment.html,Neutral
I've been testing this AI PC laptop for the last two weeks — It has a unique feature I've never seen before but disappoints in one key area,"In the course of the last 12 months, we've already seen the first two waves of Copilot+ PCs and AI PCs come to the market.
The first round featured the Intel Core Ultra 100 Series (100S) (a.k.a. Met… [+27807 chars]","The Acer Swift 14 AI is an AI PC with an Intel Core Ultra 7 258V processor, Intel Arc Graphics, and a 14-inch IPS touchscreen.",2025-01-01T14:00:00Z,Windows Central,https://www.windowscentral.com/hardware/laptops/acer-swift-14-ai-review,Neutral
Printf Debugging Is OK,"I stopped going on Twitter a while ago because it has the tendency to evoke rage, as it is designed to do. But every now and then I check back in - it can be useful sometimes for keeping up with grap… [+7907 chars]","I stopped going on Twitter a while ago because it has the tendency to evoke rage, as it is designed to do. But every now and then I check back in - it can be useful sometimes for keeping up with graphics research, gamedev news and some people do post nice thi…",2025-01-06T02:42:49Z,Polymonster.co.uk,https://www.polymonster.co.uk/blog/printf-debugging-is-ok,Neutral
Large Concept Models: Language modeling in a sentence representation space,"[Blog][Paper]
This repository provides the official implementations and experiments for Large Concept Models (LCM).
The LCM operates on an explicit higher-level semantic representation,
which we n… [+11305 chars]",Large Concept Models: Language modeling in a sentence representation space - facebookresearch/large_concept_model,2025-01-01T02:38:22Z,Github.com,https://github.com/facebookresearch/large_concept_model,Neutral
6 things you must check when building a NAS with old PC parts,Building your network-attached storage (NAS) from scratch can be exciting but there are some things to consider before repurposing an old PC. You'll want to back up all the data on the old drives bef… [+5330 chars],Some things to bear in mind when turning an old PC into a NAS.,2025-01-02T13:00:18Z,XDA Developers,https://www.xda-developers.com/things-you-must-check-when-building-a-nas-with-old-pc-parts/,Positive
3 components you can skip when building your PC (but you shouldn’t),"Lets say youre on the hunt for the coolest pixel-pushing hardware for your next PC when you realize that youve run out of budget. As it turns out, you dont really need a full repertoire of components… [+3898 chars]",Taking a barebones setup to the next level,2025-01-03T01:01:16Z,XDA Developers,https://www.xda-developers.com/components-you-can-skip-when-building-your-pc-but-you-shouldnt/,Neutral
"I'm a gaming free agent with money to burn. Help me pick between PC, Xbox, and PS5.",I recently purchased Forza Horizon 4 because it was about to be delisted from all digital storefronts. I bought the game despite the fact that I don't own an Xbox or a gaming PC. The fear of missing … [+6424 chars],"I've decided to get back into gaming but can't choose between PC, Xbox, and PS5. This is the first part of a series in which I'll explore each platform and ask for help picking the best one.",2025-01-03T17:06:15Z,Windows Central,https://www.windowscentral.com/gaming/im-a-gaming-free-agent-with-money-to-burn-help-me-pick-between-pc-xbox-and-ps5,Neutral
This is the first mini PC compatible with Microsoft's Copilot+ requirements - and it does look like the Apple Mac Mini M4,"<ul><li>Asus NUC 14 Pro AI is powered by the Core Ultra 9 288V CPU </li><li>It looks a bit like the Mac Mini, but a tad smaller </li><li>Aimed at the B2B market, it will likely be sold at a premium p… [+2395 chars]",The Asus NUC 14 Pro AI comes with a dedicated Copilot button.,2025-01-01T16:03:00Z,TechRadar,https://www.techradar.com/pro/this-is-the-first-mini-pc-thats-compatible-with-microsofts-copilot-requirements-and-it-does-look-like-the-apple-mac-mini-m4,Neutral
Micron wants a bigger slice of the $100 billion HBM market with its 2026-bound HBM4 and HBM4E memory solutions,"<ul><li>US semiconductor giant discloses HBM4 product launch in 2026, followed by HBM4E</li><li>These are likely to be used by Nvidia's Rubin R100 GPU and AMD's successor to the Instinct MI400x </li>… [+2758 chars]",Micron HBM3E 8H is included in Nvidia’s Blackwell B200 and GB200 platforms.,2025-01-04T23:25:00Z,TechRadar,https://www.techradar.com/pro/micron-wants-a-bigger-slice-of-the-usd100-billion-hbm-market-with-its-2026-bound-hbm4-and-hbm4e-memory-solutions,Neutral
AMD's throwing the considerably hefty Ryzen 9 9950X3D at gaming laptops and calling it a Ryzen 9 9955HX3D,"AMD isn't pulling any punches in gaming laptops. The company's latest plan announced over at CES 2025 is to take its beefiest 16-core/32-thread processor, whack loads more cache on the top, and run i… [+2137 chars]",That's one beefy laptop chip. If you can even call it that.,2025-01-06T19:45:00Z,PC Gamer,https://www.pcgamer.com/hardware/processors/amds-throwing-the-considerably-hefty-ryzen-9-9950x3d-at-gaming-laptops-and-calling-it-a-ryzen-9-9955hx3d/,Negative
"PowerColor Teases Radeon RX 9070 XT ""Red Devil"" GPU","Oh interesting, I didn't think the 9070 would qualify for a ""Red Devil"" level card, but maybe it has more grunt than initially thought.Either way, good news, PowerColor make great cards. I highly rec… [+62 chars]","PowerColor has prepared its highest-end Radeon RX 9070 XT GPU in the ""Red Devil"" family. In a post on the social media platform X, PowerColor shared the below picture with the following words: ""Every edge shines like a gem. Every second burns like fire. If po…",2025-01-03T09:04:59Z,Techpowerup.com,https://www.techpowerup.com/330461/powercolor-teases-radeon-rx-9070-xt-red-devil-gpu,Positive
Intel Arc GPU Graphics Drivers 101.6449 WHQL Released,"Intel has released the latest version of its Arc GPU Graphics Drivers, Version 101.6449 WHQL. The latest drivers are actually the launch driver for Intel Core Processor N-Series and Series 2, codenam… [+5601 chars]","Intel has released the latest version of its Arc GPU Graphics Drivers, Version 101.6449 WHQL. The latest drivers are actually the launch driver for Intel Core Processor N-Series and Series 2, codename Twin Lake, Raptor Lake-H Refresh, Raptor Lake-U Refresh. I…",2025-01-03T13:35:51Z,Techpowerup.com,https://www.techpowerup.com/330471/intel-arc-gpu-graphics-drivers-101-6449-whql-released,Neutral
HP ZBook Ultra 14 G1a mobile workstation with AMD Strix Halo packs up to 16 CPU cores and 40 GPU compute units into a laptop,The HP ZBook line of mobile workstations are high-performance laptop computers that typically feature discrete graphics tuned for professional use. But the new HP ZBook Ultra 14 G1a features integrat… [+3035 chars],The HP ZBook line of mobile workstations are high-performance laptop computers that typically feature discrete graphics tuned for professional use. But the new HP ZBook Ultra 14 G1a features integrated graphics that HP says are powerful enough to make a discr…,2025-01-06T19:45:24Z,Liliputing,https://liliputing.com/hp-zbook-ultra-14-g1a-mobile-workstation-with-amd-strix-halo-packs-up-to-16-cpu-cores-and-40-gpu-compute-units-into-a-laptop/,Positive
